{
  "task_id": "CRITIC-20260325-290",
  "worker": "critic",
  "status": "success",
  "summary": "Produced 1 artifact(s) for task CRITIC-20260325-290.",
  "artifacts": [
    {
      "path": "artifacts/reviews/pdf_to_excel_ocr_inbox_review.md",
      "type": "review"
    }
  ],
  "timestamp": "2026-03-26T01:25:45.937806Z",
  "duration_ms": 41666,
  "metadata": {
    "verdict": "pass"
  }
}