{
  "task_id": "AUTO-20260325-874",
  "worker": "automation",
  "status": "success",
  "summary": "Automation success via mixed failover path (s02).",
  "artifacts": [
    {
      "path": "artifacts/scripts/pdf_to_excel_ocr_inbox_runner.py",
      "type": "script"
    }
  ],
  "timestamp": "2026-03-26T04:23:20.539405Z",
  "duration_ms": 1015,
  "metadata": {
    "source": "bl090-fallback",
    "scenario": "s02"
  }
}