{
  "task_id": "AUTO-20260325-859",
  "worker": "automation",
  "status": "failed",
  "summary": "Worker execution failed",
  "artifacts": [],
  "errors": [
    "<urlopen error [SSL: UNEXPECTED_EOF_WHILE_READING] EOF occurred in violation of protocol (_ssl.c:1016)>"
  ],
  "metadata": {},
  "duration_ms": 19942,
  "timestamp": "2026-03-25T04:39:43.458204Z"
}