{
  "task_id": "AUTO-20260325-874",
  "worker": "automation",
  "status": "failed",
  "summary": "['Unable to create the requested script artifact because the automation environment lacks an accessible repository layout. Without the repository files, I cannot inspect or update artifacts/scripts/pdf_to_excel_ocr_inbox_runner.py as required.']",
  "artifacts": [],
  "timestamp": "2026-03-26T06:09:28.344238Z",
  "duration_ms": 7223,
  "errors": [
    "Repository not present in execution environment"
  ]
}