{
  "task_id": "CRITIC-20260325-276",
  "worker": "critic",
  "status": "success",
  "summary": "Reviewed the inbox runner and paired delegate together as an end-to-end readonly smoke path. The pair is generally aligned with the best-effort/evidence-backed contract, but the wrapper assumes delegate support for --report-json that the reviewed delegate does not implement, creating a real integration defect that can cause wrapper-reported failure even when the delegate otherwise works. Verdict: needs_revision.",
  "artifacts": [
    {
      "path": "artifacts/reviews/pdf_to_excel_ocr_inbox_review.md",
      "type": "review"
    }
  ],
  "timestamp": "2026-03-25T01:54:13.394469Z",
  "duration_ms": 34158,
  "notes": [
    "Review grounded in provided artifact snapshots for both scripts.",
    "Scope evaluated as wrapper + delegate pair, not as isolated files.",
    "Review artifact content is included in file_contents."
  ],
  "metadata": {
    "task_id": "CRITIC-20260325-276",
    "worker": "critic",
    "verdict": "needs_revision",
    "reviewed_artifacts": [
      "artifacts/scripts/pdf_to_excel_ocr_inbox_runner.py",
      "artifacts/scripts/pdf_to_excel_ocr.py"
    ]
  }
}