{
  "task_id": "AUTO-20260325-874",
  "worker": "automation",
  "status": "success",
  "summary": "Reused the reviewed pdf_to_excel_ocr_inbox_runner.py wrapper, marked it executable, and confirmed it still drives artifacts/scripts/pdf_to_excel_ocr.py with the expected report-json sidecar, timeout, dry-run/zero-PDF partial handling, OCR sufficiency gates, and traceable runtime summaries for this Trello preview smoke.",
  "artifacts": [
    {
      "path": "artifacts/scripts/pdf_to_excel_ocr_inbox_runner.py",
      "type": "script"
    }
  ],
  "timestamp": "2026-03-26T03:15:42.510761Z",
  "duration_ms": 115856
}