{
  "task_id": "AUTO-20260323-219",
  "worker": "automation",
  "status": "success",
  "summary": "Generated one deterministic local Python helper script artifact that scans PDFs from the configured input directory and writes a reviewable manifest to the configured .xlsx path using only standard-library behavior plus optional openpyxl if available, with a CSV fallback written at the same target path when XLSX support is unavailable.",
  "artifacts": [
    {
      "path": "artifacts/scripts/pdf_to_excel_ocr_inbox_runner.py",
      "type": "script"
    }
  ],
  "timestamp": "2026-03-23T11:25:55.441801Z",
  "duration_ms": 43076,
  "notes": [
    "The script is best-effort and intentionally does not claim OCR or text extraction success without local evidence.",
    "The script produces a deterministic PDF inventory manifest suitable for review.",
    "If openpyxl is unavailable, the script writes CSV-formatted manifest data to the requested output path for reviewability rather than claiming real XLSX generation."
  ],
  "metadata": {
    "task_id": "AUTO-20260323-219",
    "worker": "automation",
    "request_type": "pdf_to_excel_ocr",
    "origin_id": "trello:69c1229edc9b8ec895640c5b"
  }
}