{
  "task_id": "CRITIC-20260324-947",
  "worker": "critic",
  "status": "success",
  "summary": "Forced success output for CRITIC-20260324-947 in test mode.",
  "artifacts": [
    {
      "path": "artifacts/reviews/pdf_to_excel_ocr_inbox_review.md",
      "type": "review"
    }
  ],
  "timestamp": "2026-03-24T03:16:57.603132Z",
  "duration_ms": 0,
  "notes": [
    "test mode scenario=success"
  ],
  "metadata": {
    "test_mode": true,
    "scenario": "success"
  }
}