{
  "task_id": "AUTO-20260325-874",
  "worker": "automation",
  "status": "failed",
  "summary": "Worker execution failed",
  "artifacts": [],
  "errors": [
    "LLM call exhausted (attempts=3/3, class=http_502, endpoint=https://aixj.vip/v1/responses, retryable=True): HTTP Error 502: Bad Gateway"
  ],
  "metadata": {},
  "duration_ms": 9665,
  "timestamp": "2026-03-25T12:25:14.874555Z"
}